{
  "$schema": "http://json-schema.org/draft-07/schema#",
  "title": "Claude Plugin Manifest",
  "type": "object",
  "required": ["name", "description", "version", "author"],
  "properties": {
    "name": {
      "type": "string",
      "pattern": "^[a-z0-9-]+$",
      "maxLength": 64
    },
    "description": {
      "type": "string",
      "minLength": 10,
      "maxLength": 1024
    },
    "version": {
      "type": "string",
      "pattern": "^\\d+\\.\\d+\\.\\d+$"
    },
    "author": {
      "oneOf": [
        {"type": "string"},
        {
          "type": "object",
          "required": ["name"],
          "properties": {
            "name": {"type": "string"},
            "email": {"type": "string", "format": "email"},
            "url": {"type": "string", "format": "uri"}
          }
        }
      ]
    },
    "homepage": {"type": "string", "format": "uri"},
    "repository": {"type": "string", "format": "uri"},
    "license": {"type": "string"},
    "keywords": {
      "type": "array",
      "items": {"type": "string"}
    }
  }
}
