{
  "name": "jira",
  "version": "2.14.1",
  "description": "Jira integration via Atlassian MCP server. Create issues, search projects, update statuses, manage workflows, and integrate development with Jira's project management platform.",
  "author": {
    "name": "baleen",
    "email": "git@baleen.me"
  }
}
