{
  "$schema": "https://anthropic.com/claude-code/plugin.schema.json",
  "name": "example-plugin",
  "description": "Example plugin demonstrating all Claude Code plugin component types",
  "version": "1.0.0",
  "author": {
    "name": "Your Name",
    "email": "your.email@example.com"
  },
  "homepage": "https://github.com/YOUR_USERNAME/claude-plugin-boilerplate",
  "repository": "https://github.com/YOUR_USERNAME/claude-plugin-boilerplate",
  "license": "MIT",
  "keywords": ["claude-code", "plugin", "boilerplate", "example"]
}
