{
  "name": "ralph-loop",
  "version": "2.4.12",
  "description": "Continuous self-referential AI loops for interactive iterative development, implementing the Ralph Wiggum technique. Run Claude in a while-true loop with the same prompt until task completion.",
  "author": {
    "name": "Anthropic",
    "email": "support@anthropic.com"
  }
}
